{
  "id": "0001",
  "film": "Kodak 5219",
  "camera": "Pentax KX",
  "date": {
    "started": "2022-10-03",
    "finished": "2023-01-14"
  },
  "development": {
    "lab": "上海, 菲林公园",
    "process": "ECN-2",
    "digitization": {
      "method": "scanner",
      "brand": "Noritsu",
      "model": null
    }
  },
  "note": ""
}